{
  "schema": "eda_block_diagram.v0.1",
  "source": {
    "image_path": "eda-problem-6/datasets/Hidden/images/EDA_TESTs_015.jpg",
    "image_width": 1116,
    "image_height": 372
  },
  "diagram": {
    "title": null,
    "domain": ["control_system", "robotics", "quadcopter"],
    "view_type": "block_diagram"
  },
  "nodes": [
    {
      "id": "n_zd",
      "kind": "source_sink",
      "label": "z_d",
      "bbox": {"x": 4, "y": 13, "w": 42, "h": 54},
      "ports": ["p_zd_out"],
      "confidence": 0.93
    },
    {
      "id": "n_xd",
      "kind": "source_sink",
      "label": "x_d",
      "bbox": {"x": 4, "y": 72, "w": 42, "h": 54},
      "ports": ["p_xd_out"],
      "confidence": 0.93
    },
    {
      "id": "n_yd",
      "kind": "source_sink",
      "label": "y_d",
      "bbox": {"x": 4, "y": 132, "w": 42, "h": 54},
      "ports": ["p_yd_out"],
      "confidence": 0.93
    },
    {
      "id": "n_psid",
      "kind": "source_sink",
      "label": "psi_d",
      "bbox": {"x": 482, "y": 213, "w": 42, "h": 54},
      "ports": ["p_psid_out"],
      "confidence": 0.9
    },
    {
      "id": "n_sum_z",
      "kind": "operator",
      "subtype": "math.sum",
      "label": "+/-",
      "bbox": {"x": 80, "y": 22, "w": 31, "h": 31},
      "ports": ["p_sum_z_ref", "p_sum_z_feedback", "p_sum_z_out"],
      "properties": {
        "inputs": [
          {"port": "p_sum_z_ref", "sign": "+"},
          {"port": "p_sum_z_feedback", "sign": "-"}
        ]
      },
      "confidence": 0.9
    },
    {
      "id": "n_sum_x",
      "kind": "operator",
      "subtype": "math.sum",
      "label": "+/-",
      "bbox": {"x": 80, "y": 82, "w": 31, "h": 31},
      "ports": ["p_sum_x_ref", "p_sum_x_feedback", "p_sum_x_out"],
      "properties": {
        "inputs": [
          {"port": "p_sum_x_ref", "sign": "+"},
          {"port": "p_sum_x_feedback", "sign": "-"}
        ]
      },
      "confidence": 0.9
    },
    {
      "id": "n_sum_y",
      "kind": "operator",
      "subtype": "math.sum",
      "label": "+/-",
      "bbox": {"x": 80, "y": 142, "w": 31, "h": 31},
      "ports": ["p_sum_y_ref", "p_sum_y_feedback", "p_sum_y_out"],
      "properties": {
        "inputs": [
          {"port": "p_sum_y_ref", "sign": "+"},
          {"port": "p_sum_y_feedback", "sign": "-"}
        ]
      },
      "confidence": 0.9
    },
    {
      "id": "n_pid_altitude",
      "kind": "functional_block",
      "subtype": "controller.pid",
      "label": "PID",
      "text": {"main": "PID", "lines": ["PID", "For altitude"]},
      "bbox": {"x": 226, "y": 20, "w": 145, "h": 52},
      "ports": ["p_pid_alt_in", "p_pid_alt_out"],
      "properties": {"role": "altitude controller"},
      "confidence": 0.94
    },
    {
      "id": "n_pid_x",
      "kind": "functional_block",
      "subtype": "controller.pid",
      "label": "PID",
      "text": {"main": "PID", "lines": ["PID", "For x position"]},
      "bbox": {"x": 226, "y": 79, "w": 145, "h": 52},
      "ports": ["p_pid_x_in", "p_pid_x_out"],
      "properties": {"role": "x position controller"},
      "confidence": 0.94
    },
    {
      "id": "n_pid_y",
      "kind": "functional_block",
      "subtype": "controller.pid",
      "label": "PID",
      "text": {"main": "PID", "lines": ["PID", "For y position"]},
      "bbox": {"x": 226, "y": 139, "w": 145, "h": 52},
      "ports": ["p_pid_y_in", "p_pid_y_out"],
      "properties": {"role": "y position controller"},
      "confidence": 0.94
    },
    {
      "id": "n_conversion",
      "kind": "functional_block",
      "subtype": "control.conversion",
      "label": "Conversion",
      "text": {
        "main": "Conversion",
        "lines": ["Conversion", "Convert control", "signals T to", "attitude set-points"]
      },
      "bbox": {"x": 401, "y": 98, "w": 160, "h": 92},
      "ports": ["p_conversion_t_in", "p_conversion_tx_in", "p_conversion_ty_in", "p_conversion_phi_out", "p_conversion_theta_out"],
      "confidence": 0.92
    },
    {
      "id": "n_sum_phi",
      "kind": "operator",
      "subtype": "math.sum",
      "label": "+/-",
      "bbox": {"x": 590, "y": 104, "w": 31, "h": 31},
      "ports": ["p_sum_phi_ref", "p_sum_phi_feedback", "p_sum_phi_out"],
      "properties": {
        "inputs": [
          {"port": "p_sum_phi_ref", "sign": "+"},
          {"port": "p_sum_phi_feedback", "sign": "-"}
        ]
      },
      "confidence": 0.88
    },
    {
      "id": "n_sum_theta",
      "kind": "operator",
      "subtype": "math.sum",
      "label": "+/-",
      "bbox": {"x": 626, "y": 155, "w": 31, "h": 31},
      "ports": ["p_sum_theta_ref", "p_sum_theta_feedback", "p_sum_theta_out"],
      "properties": {
        "inputs": [
          {"port": "p_sum_theta_ref", "sign": "+"},
          {"port": "p_sum_theta_feedback", "sign": "-"}
        ]
      },
      "confidence": 0.88
    },
    {
      "id": "n_sum_psi",
      "kind": "operator",
      "subtype": "math.sum",
      "label": "+/-",
      "bbox": {"x": 658, "y": 213, "w": 31, "h": 31},
      "ports": ["p_sum_psi_ref", "p_sum_psi_feedback", "p_sum_psi_out"],
      "properties": {
        "inputs": [
          {"port": "p_sum_psi_ref", "sign": "+"},
          {"port": "p_sum_psi_feedback", "sign": "-"}
        ]
      },
      "confidence": 0.88
    },
    {
      "id": "n_pid_mfnn_phi",
      "kind": "functional_block",
      "subtype": "controller.pid_mfnn",
      "label": "PID - MFNN",
      "text": {"main": "PID - MFNN", "lines": ["PID - MFNN", "For phi"]},
      "bbox": {"x": 721, "y": 91, "w": 132, "h": 48},
      "ports": ["p_pid_mfnn_phi_in", "p_pid_mfnn_phi_out"],
      "confidence": 0.91
    },
    {
      "id": "n_pid_mfnn_theta",
      "kind": "functional_block",
      "subtype": "controller.pid_mfnn",
      "label": "PID - MFNN",
      "text": {"main": "PID - MFNN", "lines": ["PID - MFNN", "For theta"]},
      "bbox": {"x": 721, "y": 148, "w": 132, "h": 48},
      "ports": ["p_pid_mfnn_theta_in", "p_pid_mfnn_theta_out"],
      "confidence": 0.91
    },
    {
      "id": "n_pid_mfnn_psi",
      "kind": "functional_block",
      "subtype": "controller.pid_mfnn",
      "label": "PID - MFNN",
      "text": {"main": "PID - MFNN", "lines": ["PID - MFNN", "For psi"]},
      "bbox": {"x": 721, "y": 207, "w": 132, "h": 48},
      "ports": ["p_pid_mfnn_psi_in", "p_pid_mfnn_psi_out"],
      "confidence": 0.91
    },
    {
      "id": "n_quadcopter",
      "kind": "functional_block",
      "subtype": "system.dynamics",
      "label": "Quadcopter Dynamics",
      "bbox": {"x": 886, "y": 13, "w": 151, "h": 213},
      "ports": ["p_quadcopter_u1", "p_quadcopter_u2", "p_quadcopter_u3", "p_quadcopter_u4", "p_quadcopter_state_out"],
      "confidence": 0.95
    }
  ],
  "ports": [
    {"id": "p_zd_out", "node": "n_zd", "direction": "out", "side": "right", "signal": "z_d"},
    {"id": "p_xd_out", "node": "n_xd", "direction": "out", "side": "right", "signal": "x_d"},
    {"id": "p_yd_out", "node": "n_yd", "direction": "out", "side": "right", "signal": "y_d"},
    {"id": "p_psid_out", "node": "n_psid", "direction": "out", "side": "right", "signal": "psi_d"},
    {"id": "p_sum_z_ref", "node": "n_sum_z", "direction": "in", "side": "left", "signal": "z_d"},
    {"id": "p_sum_z_feedback", "node": "n_sum_z", "direction": "in", "side": "bottom", "signal": "z"},
    {"id": "p_sum_z_out", "node": "n_sum_z", "direction": "out", "side": "right"},
    {"id": "p_sum_x_ref", "node": "n_sum_x", "direction": "in", "side": "left", "signal": "x_d"},
    {"id": "p_sum_x_feedback", "node": "n_sum_x", "direction": "in", "side": "bottom", "signal": "x"},
    {"id": "p_sum_x_out", "node": "n_sum_x", "direction": "out", "side": "right"},
    {"id": "p_sum_y_ref", "node": "n_sum_y", "direction": "in", "side": "left", "signal": "y_d"},
    {"id": "p_sum_y_feedback", "node": "n_sum_y", "direction": "in", "side": "bottom", "signal": "y"},
    {"id": "p_sum_y_out", "node": "n_sum_y", "direction": "out", "side": "right"},
    {"id": "p_pid_alt_in", "node": "n_pid_altitude", "direction": "in", "side": "left"},
    {"id": "p_pid_alt_out", "node": "n_pid_altitude", "direction": "out", "side": "right", "signal": "U1"},
    {"id": "p_pid_x_in", "node": "n_pid_x", "direction": "in", "side": "left"},
    {"id": "p_pid_x_out", "node": "n_pid_x", "direction": "out", "side": "right", "signal": "T_x"},
    {"id": "p_pid_y_in", "node": "n_pid_y", "direction": "in", "side": "left"},
    {"id": "p_pid_y_out", "node": "n_pid_y", "direction": "out", "side": "right", "signal": "T_y"},
    {"id": "p_conversion_t_in", "node": "n_conversion", "direction": "in", "side": "left", "signal": "T"},
    {"id": "p_conversion_tx_in", "node": "n_conversion", "direction": "in", "side": "left", "signal": "T_x"},
    {"id": "p_conversion_ty_in", "node": "n_conversion", "direction": "in", "side": "left", "signal": "T_y"},
    {"id": "p_conversion_phi_out", "node": "n_conversion", "direction": "out", "side": "right", "signal": "phi_d"},
    {"id": "p_conversion_theta_out", "node": "n_conversion", "direction": "out", "side": "right", "signal": "theta_d"},
    {"id": "p_sum_phi_ref", "node": "n_sum_phi", "direction": "in", "side": "left", "signal": "phi_d"},
    {"id": "p_sum_phi_feedback", "node": "n_sum_phi", "direction": "in", "side": "bottom", "signal": "phi"},
    {"id": "p_sum_phi_out", "node": "n_sum_phi", "direction": "out", "side": "right", "signal": "U2"},
    {"id": "p_sum_theta_ref", "node": "n_sum_theta", "direction": "in", "side": "left", "signal": "theta_d"},
    {"id": "p_sum_theta_feedback", "node": "n_sum_theta", "direction": "in", "side": "bottom", "signal": "theta"},
    {"id": "p_sum_theta_out", "node": "n_sum_theta", "direction": "out", "side": "right", "signal": "U3"},
    {"id": "p_sum_psi_ref", "node": "n_sum_psi", "direction": "in", "side": "left", "signal": "psi_d"},
    {"id": "p_sum_psi_feedback", "node": "n_sum_psi", "direction": "in", "side": "bottom", "signal": "psi"},